### ISSUE TITLE
Tempest not detected, separate subnets

### ISSUE THREAD

**Issue by albatorsk** [briis/smartweatherudp#55]
I'm using Home Assistant on Home Assistant OS and I have tried setting up this integration with my Tempest, but the integration can not find the device.

My Tempest is on a different VLAN and subnet from Home Asistant, however traffic should be flowing between the subnets. I have verified this by putting another computer on the same subnet as my Home Assistant and listening for UDP traffic:

`albatorsk@computer-not-on-the-tempest-subnet:~$ sudo tcpdump -A -i enp11s0 'port 50222'
tcpdump: verbose output suppressed, use -v[v]... for full protocol decode
listening on enp11s0, link-type EN10MB (Ethernet), snapshot length 262144 bytes
14:32:46.557563 IP FQDN-to-Tempest.50222 > 255.255.255.255.50222: UDP, length 218
E...v.....0O

...........'.{"serial_number":"HB-00110427","type":"hub_status","firmware_revision":"177","uptime":698025,"rssi":-57,"timestamp":1671802364,"reset_flags":"BOR,PIN,POR","seq":69755,"radio_stats":[26,1,0,3,1223],"mqtt_stats":[829,0]}
14:32:47.466839 IP FQDN-to-Tempest.50222 > 255.255.255.255.50222: UDP, length 99
E...v.....0.

..........k5.{"serial_number":"ST-00096955","type":"rapid_wind","hub_sn":"HB-00110427","ob":[1671802365,1.24,7]}
14:32:50.465063 IP FQDN-to-Tempest.50222 > 255.255.255.255.50222: UDP, length 100
E...v.....0.

..........l^.{"serial_number":"ST-00096955","type":"rapid_wind","hub_sn":"HB-00110427","ob":[1671802368,1.60,11]}
14:32:53.467725 IP FQDN-to-Tempest.50222 > 255.255.255.255.50222: UDP, length 100
E...v.....0.

..........l\.{"serial_number":"ST-00096955","type":"rapid_wind","hub_sn":"HB-00110427","ob":[1671802371,1.61,11]}
14:32:56.468502 IP FQDN-to-Tempest.50222 > 255.255.255.255.50222: UDP, length 100
E...v.....0.
`

When I first set up the integration, it searches for a device and then it appears to time out and ask for a host IP. Entering 0.0.0.0 and waiting a few seconds results in it coming back and saying that no device was found. If I enter the Tempest IP, it won't accept that. If I enter my HA IP, it has the same result as entering 0.0.0.0.

What am I missing?

**Comment by remkolems** [comment]
I'm in the same boat unfortunately. Exactly as in OP.

**Comment by natekspencer** [comment]
Unfortunately my networking skills aren't the greatest and I don't have a similar setup to be able to test this out, so I'd just be shooting in the dark.

My first suggestion would be to try your python skills out with the library that supports this and see if it detects the broadcasts from your Tempest device on another subnet: https://github.com/briis/pyweatherflowudp

If that works, then we can eliminate the library as the issue and move to this integration and/or the Home Assistant environment as the actual issue. If it doesn't, then I'd still need help with someone figuring it out and committing the changes to code.

**Comment by albatorsk** [comment]
I've done some additional investigation and it appears the problem is **not related to this integration** at all, but rather to my ESXi configuration somehow, as I foolishly neglected to mention that I'm running HA in a virtual machine.

If I deploy a VM on my regular non-IoT network where I have my Home Assistant, that VM does not receive the UDP broadcast. If I move the VM to the IoT network where the Tempest is, it receives the broadcast. However, if I put a physical machine on the non-IoT network, that also receives the broadcast. So, I have concluded that something's up with my VMware ESXi config.

In my case, I have worked around the issue by deploying a tiny VM with the [Weatherflow-2-MQTT](https://github.com/briis/hass-weatherflow2mqtt) docker image running on the IoT network where my Tempest is, and then allowing that access to connect to my HA Mosquitto server residing on the non-IoT network.

@remkolems Maybe this is of some help to you to work around your issue as well.

**Comment by remkolems** [comment]
It did work work with my current network setup a couple of weeks ago. I thought it had to do with the battery failing of my Weatherflow device (Sky) in combination with Solar-Power-Accessory. So I therefore modded my device according to https://community.weatherflow.com/t/easy-sky-spa-battery-expansion-unofficial/12571

In hindsight I suspect some recent changes in regards to updates of (again) home-assistant. My python skills are rusty to say the least, but I'll definitely give it a try though. Thanks for the suggestions! I will try them out where possible.

**Comment by remkolems** [comment]
Ok, I solved it. Removed several related home assistant rules from my firewall. And udp broadcast to 255.255.255.255:50222 was silently blocked. That was the culprit.

Seems to me that this issue can be closed.
